{
  "track_id": "merge-newtrack-fb_20251223",
  "type": "feature",
  "status": "archived",
  "priority": "high",
  "depends_on": [],
  "estimated_hours": null,
  "created_at": "2025-12-23T10:00:00Z",
  "updated_at": "2025-12-23T10:00:00Z",
  "description": "Merge /conductor-newtrack and fb into single seamless flow",
  "has_design": true,
  "threads": [
    {
      "id": "T-019b4a25-c3eb-773e-ba1d-dfd80ee19092",
      "action": "design",
      "timestamp": "2025-12-23T10:00:00Z"
    }
  ]
}
