{
  "track_id": "state-consolidation_20251227",
  "type": "feature",
  "status": "new",
  "priority": "high",
  "created_at": "2025-12-27T20:00:00Z",
  "updated_at": "2025-12-27T20:00:00Z",
  "description": "Consolidate state files (3â†’1 per track) and integrate continuity with Conductor workflow",
  "has_design": true,
  "threads": [
    {
      "id": "T-019b5f20-0154-7299-b711-d83ce2cefbc4",
      "action": "design",
      "timestamp": "2025-12-27T20:00:00Z"
    }
  ],
  "artifacts": {
    "design": true,
    "spec": true,
    "plan": true,
    "beads": true
  },
  "workflow": {
    "state": "REVIEWED",
    "history": [
      {
        "state": "INIT",
        "at": "2025-12-27T20:00:00Z",
        "command": "newtrack"
      },
      {
        "state": "DESIGNED",
        "at": "2025-12-27T20:00:00Z",
        "command": "ds"
      },
      {
        "state": "TRACKED",
        "at": "2025-12-27T20:10:00Z",
        "command": "newtrack"
      },
      {
        "state": "FILED",
        "at": "2025-12-27T09:42:32Z",
        "command": "fb"
      },
      {
        "state": "REVIEWED",
        "at": "2025-12-27T09:46:07Z",
        "command": "rb"
      }
    ],
    "branch": null,
    "archived": false,
    "keep": false
  }
}
